commit	throughput	p95_ttft	gsm8k_em	status	description
91dbf2c	6.66	141.3	0.9000	discard	exp-151 no-enable-log-requests: 6.66 (bad state p50=108ms — inconclusive, need retest)
91dbf2c	6.84	86.6	0.9000	discard	exp-152 VLLM_FUSED_MOE_CHUNK_SIZE=65536: 6.84 (good state — neutral, 32768 already optimal)
09d7e9c	6.63	124.8	0.9000	discard	exp-153 no-enable-log-requests retest: 6.63 (bad state again — inconclusive)
09d7e9c	0.00	0.0	0.0000	crash	exp-154 optimization-level=4: crash — only 0-3 valid; retrying with 3
17b52ef	6.65	131.7	0.9000	discard	exp-155 optimization-level=3: 6.65 (bad state p50=107ms — inconclusive)
17b52ef	6.62	141.1	0.9000	discard	exp-156 no-enable-log-requests retest: 6.62 (bad state p50=111ms — persistent bad state)
9370a92	6.63	132.3	0.9000	discard	exp-157 MALLOC_ARENA_MAX=4: 6.63 (bad state p50=111ms — inconclusive)
9370a92	6.66	139.9	0.9000	discard	exp-158 VLLM_CUDAGRAPH_CAPTURE_SIZES=1,2,4,8,16: 6.66 (bad state p50=109ms — inconclusive)
3926cb3	6.65	144.2	0.9000	discard	exp-159 disable-log-stats+no-log-requests: 6.65 (bad state — inconclusive)
3926cb3	6.81	137.9	0.9000	discard	exp-160 TOKENIZERS_PARALLELISM=false: 6.81 (good state but p95=137ms worse — neutral/discard)
089e4c2	6.61	146.2	0.9000	discard	exp-161 optimization-level=3 retest: 6.61 (bad state again — persistent gpu-01 bad)
089e4c2	6.83	87.0	0.9000	discard	exp-162 gdn-prefill-backend=flashinfer: 6.83 (good state — neutral, no improvement)
65268f4	6.84	111.2	0.9000	discard	exp-164 VLLM_FUSED_MOE_CHUNK_SIZE=16384: 6.84 (good state — neutral, 32768 still best)
65268f4	6.80	148.9	0.9000	discard	exp-163 optimization-level=3: 6.80 (good state — slightly worse, high p95=148ms)
e10329e	6.81	145.0	0.9000	discard	exp-165 VLLM_LOGGING_LEVEL=CRITICAL: 6.81 (good state — worse, high p95=145ms)
e10329e	6.86	89.7	0.9000	keep?	exp-166 VLLM_ATTENTION_BACKEND=TRITON_MLA: 6.86 (+0.03 vs 6.83 — MLA-optimized backend! Confirm needed)
4b63b3d	6.81	110.0	0.9000	discard	exp-167 TRITON_MLA retest gpu-01: 6.81 (good state — neutral, exp-166 was noise)
4b63b3d	6.66	123.5	0.9000	discard	exp-168 TRITON_MLA retest gpu-02: 6.66 (bad state — TRITON_MLA confirmed neutral)
1974f1a	6.81	90.2	0.9000	discard	exp-169 no-enable-log-requests clean retest: 6.81 (good state — slightly worse, confirmed discard)
1974f1a	6.85	91.9	0.9000	keep	exp-170 disable-log-stats clean retest: 6.85 (good state — confirmed +0.02! 2nd data point matches exp-139)
1449e7b	6.79	98.5	0.9000	discard	exp-171 max-num-seqs=192 with new base: 6.79 (good state — still worse, 176 optimal)
1449e7b	6.66	127.7	0.9000	discard	exp-172 max-num-seqs=184: 6.66 (bad state — inconclusive)
